{
  "$schema": "https://json-schema.org/draft/2020-12/schema",
  "$id": "https://github.com/3dyonic/open-ux/catalog/schema.json",
  "title": "Open UX guideline",
  "description": "One cited guideline file. Placement points into catalog/jobs.json. Agent-facing fields live here, never in SKILL.md.",
  "type": "object",
  "additionalProperties": false,
  "required": [
    "id",
    "title",
    "rule",
    "citation",
    "check",
    "pass_when",
    "fail_when",
    "severity",
    "container",
    "card",
    "facet"
  ],
  "properties": {
    "id": {
      "type": "string",
      "minLength": 1,
      "pattern": "^[a-z0-9._-]+$"
    },
    "category": { "type": "string", "minLength": 1 },
    "segment": { "type": "string", "minLength": 1 },
    "title": { "type": "string", "minLength": 1 },
    "rule": { "type": "string", "minLength": 1 },
    "rationale": { "type": "string" },
    "citation": {
      "description": "One cited source, or an array when more than one URL supports the same claim.",
      "oneOf": [
        { "$ref": "#/$defs/citation" },
        {
          "type": "array",
          "minItems": 1,
          "items": { "$ref": "#/$defs/citation" }
        }
      ]
    },
    "applies_to": {
      "type": "array",
      "items": { "type": "string" }
    },
    "check": {
      "type": "string",
      "enum": ["deterministic", "llm_judgment", "either"]
    },
    "pass_when": {
      "type": "array",
      "items": { "type": "string" },
      "minItems": 1
    },
    "fail_when": {
      "type": "array",
      "items": { "type": "string" },
      "minItems": 1
    },
    "examples": {
      "type": "array",
      "items": { "$ref": "#/$defs/example" }
    },
    "severity": {
      "type": "string",
      "enum": ["blocker", "major", "minor", "info"]
    },
    "container": {
      "type": "string",
      "enum": [
        "forms_and_input",
        "actions_and_decisions",
        "feedback_and_status",
        "navigation_and_wayfinding",
        "layout_and_data_display",
        "overlays_and_content_structure",
        "multi_step_flows"
      ]
    },
    "card": {
      "type": "string",
      "enum": [
        "design_a_form",
        "handle_form_errors",
        "compose_sign_in",
        "design_actions_and_ctas",
        "protect_destructive_and_leave",
        "compose_feedback",
        "orient_in_the_place",
        "compose_search",
        "compose_a_data_display",
        "compose_the_layout",
        "write_the_interface",
        "choose_an_overlay",
        "build_a_multi_step_flow"
      ]
    },
    "facet": { "type": "string", "minLength": 1 },
    "leaf": {
      "type": "string",
      "enum": [
        "avoid_placeholder_as_label",
        "name_a_control",
        "choose_control_for_choice",
        "use_familiar_control",
        "group_related_inputs",
        "mark_requirements_up_front",
        "word_the_field_help",
        "explain_failure_next_to_cause",
        "recover_from_invalid_input",
        "show_the_password",
        "pick_primary_action",
        "word_the_action",
        "compose_the_command_surface",
        "show_action_state",
        "keep_hit_target_usable",
        "disable_or_confirm_destructive",
        "warn_before_leave",
        "announce_system_status",
        "write_empty_state",
        "tone_of_voice_for_failure",
        "wayfind_after_nav",
        "place_the_search_control",
        "chart_has_a_story",
        "map_is_not_the_only_channel",
        "keep_the_page_scannable",
        "name_the_link_by_destination",
        "write_to_you",
        "pick_modal_only_when_blocking",
        "disclose_instead_of_dump",
        "show_step_progress"
      ]
    },
    "overview": { "type": "string", "minLength": 1 },
    "apply_when": { "type": "string", "minLength": 1 },
    "not_when": { "type": "string", "minLength": 1 },
    "agent_hint": { "type": "string", "minLength": 1 },
    "description": { "type": "string", "minLength": 1 },
    "waive_reason": { "type": "string", "minLength": 1 },
    "jobs": {
      "type": "array",
      "items": { "type": "string" },
      "description": "Legacy harvest tags. Not placement SoT."
    },
    "patterns": {
      "type": "array",
      "items": { "type": "string" }
    },
    "ux_dimensions": {
      "type": "array",
      "items": { "type": "string" }
    },
    "source_scheme": { "type": "string" },
    "do_not_claim": {
      "type": "string",
      "description": "Craft-pass fence. Optional; omit when the source row has none."
    }
  },
  "$defs": {
    "citation": {
      "type": "object",
      "additionalProperties": false,
      "required": ["source", "url"],
      "properties": {
        "source": { "type": "string", "minLength": 1 },
        "url": { "type": "string", "minLength": 1, "format": "uri" }
      }
    },
    "example": {
      "type": "object",
      "additionalProperties": false,
      "properties": {
        "good": { "type": "string" },
        "bad": { "type": "string" }
      }
    }
  }
}
