{
  "id": "nsw.chart-text-horizontal",
  "category": "Content",
  "segment": "Charts",
  "title": "chart text horizontal",
  "rule": "Keep chart text horizontal; long categories → horizontal bar, don’t rotate. If a tool forces rotation, cap 45° and keep ≥12px at all viewports. Min sizes: title 16–18px, data labels 12px, notes 11–12px. Y-axis labels right-aligned; X centred. Commas in thousands; no digit spaces (AT).",
  "citation": [
    {
      "source": "NSW — Charts and graphs",
      "url": "https://designsystem.nsw.gov.au/docs/content/methods/charts-and-graphs.html"
    }
  ],
  "check": "llm_judgment",
  "pass_when": [
    "Labels stay horizontal (or ≤45° if the tool forces rotation, ≥12px); long categories use a horizontal bar; thousands use commas not spaces."
  ],
  "fail_when": [
    "Rotated labels to avoid a horizontal bar; digit spaces in thousands."
  ],
  "severity": "major",
  "container": "layout_and_data_display",
  "card": "compose_a_data_display",
  "facet": "data_is_unscannable",
  "leaf": "chart_has_a_story",
  "overview": "Keep chart text horizontal; use horizontal bars for long categories.",
  "apply_when": "Labeling axes, categories, and data on charts.",
  "not_when": "Rotating labels to avoid a horizontal bar, or digit spaces in thousands.",
  "agent_hint": "Keep labels horizontal; prefer horizontal bars for long categories; comma thousands.",
  "description": "Keep chart text horizontal; for long categories use a horizontal bar, don’t rotate. If a tool forces rotation, cap 45° and keep ≥12px. Min sizes: title 16–18px, data labels 12px, notes 11–12px. Y-axis labels right-aligned; X centred. Commas in thousands; no digit spaces. Pass when labels stay horizontal (or ≤45° if forced, ≥12px), long categories use a horizontal bar, and thousands use commas. Fail when labels rotate to avoid a horizontal bar or thousands use digit spaces.",
  "do_not_claim": "WCAG contrast SC; 44px hit targets."
}
