{
  "id": "nng.guest-checkout-prominent",
  "category": "Forms",
  "segment": "Checkout",
  "title": "guest checkout prominent",
  "rule": "Guest checkout prominent (above sign-in); optional password in-flow; mark password optional; user-benefit copy not newsletter pitch.",
  "citation": {
    "source": "NN/g — Don’t Force Users to Register Before They Can Buy; NN/g — The Mobile Checkout Experience",
    "url": "https://www.nngroup.com/articles/optional-registration/"
  },
  "check": "llm_judgment",
  "pass_when": [
    "Guest checkout is prominent and above sign-in; password in-flow is optional and labeled optional; copy states user benefit, not a newsletter pitch."
  ],
  "fail_when": [
    "Forced register-before-buy; guest buried under sign-in; password required in-flow; newsletter pitch as the reason."
  ],
  "severity": "major",
  "container": "actions_and_decisions",
  "card": "design_actions_and_ctas",
  "facet": "no_clear_primary",
  "leaf": "pick_primary_action",
  "waive_reason": "agent_fields pending — do not invent from harvest stencil",
  "do_not_claim": "Paywalled 137-rec report."
}
