{
  "id": "spectrum.picker-readonly-only-if-selection",
  "category": "Forms",
  "segment": "Picker",
  "title": "picker readonly only if selection",
  "rule": "Read-only only if a selection exists — a picker with no selection has no read-only option.",
  "citation": {
    "source": "Spectrum — Picker",
    "url": "https://spectrum.adobe.com/page/picker/"
  },
  "check": "deterministic",
  "pass_when": [
    "Read-only picker has a selection. Empty picker is not read-only."
  ],
  "fail_when": [
    "Read-only picker with no selection."
  ],
  "severity": "major",
  "container": "forms_and_input",
  "card": "design_a_form",
  "facet": "wrong_control_for_the_choice",
  "leaf": "use_familiar_control",
  "overview": "A read-only picker is allowed only when a selection already exists.",
  "apply_when": "Showing a locked picker value that must remain visible after choice.",
  "not_when": "Empty unset pickers, or disabled unavailable fields with no value to keep.",
  "agent_hint": "Make a picker read-only only after it has a selection; never empty read-only.",
  "description": "Spectrum allows read-only on a picker only when a selection already exists. An empty picker has no read-only option, because there is no value to preserve. Use read-only when the chosen value must stay visible and non-editable; leave unset pickers interactive or omit the control rather than marking them read-only. Do not confuse this with disabled unavailable fields that are out of play entirely.",
  "do_not_claim": "Text-field read-only vs disabled as this row."
}
