{
  "id": "fluent.ios-chrome-back-done-cancel",
  "category": "Actions",
  "segment": "Buttons",
  "title": "ios chrome back done cancel",
  "rule": "iOS chrome: Back top-left; Done/Save top-right; Cancel top-left when paired with Done/Save, else Cancel top-right.",
  "citation": {
    "source": "Fluent 2 — iOS Button usage",
    "url": "https://fluent2.microsoft.design/components/ios/core/button/usage"
  },
  "check": "deterministic",
  "pass_when": [
    "iOS: Back top-left; Done/Save top-right; Cancel top-left when paired with Done/Save, otherwise Cancel top-right."
  ],
  "fail_when": [
    "Those controls swapped against that pairing."
  ],
  "severity": "major",
  "container": "actions_and_decisions",
  "card": "design_actions_and_ctas",
  "facet": "no_clear_primary",
  "leaf": "pick_primary_action",
  "overview": "Fluent iOS chrome puts Back top-left and Done/Save top-right with Cancel pairing rules.",
  "apply_when": "Placing Back, Done, Save, or Cancel in Fluent iOS navigation chrome.",
  "not_when": "Android or web app bars that follow a different platform chrome map.",
  "agent_hint": "Back top-left; Done/Save top-right; Cancel top-left with Done/Save, else top-right.",
  "description": "On Fluent iOS navigation chrome, Back sits top-left and Done or Save sits top-right. Cancel is top-left when it is paired with Done or Save; otherwise Cancel sits top-right. Keep that pairing so platform muscle memory holds. Apply when placing those chrome actions on Fluent iOS screens, not Android or web app bars. Fail swapping those controls against that pairing.",
  "do_not_claim": "A global web OK/Cancel order (`actions.buttons.follow_platform_ok_cancel_order`). Overlap with Actions 40: `follow_platform_ok_cancel_order`."
}
