{
  "id": "govuk.calendar-control-when",
  "category": "Forms",
  "segment": "Dates",
  "title": "calendar control when",
  "rule": "Calendar control only if the date is near future or recent past and weekday/week-of-month matters; never JS-only — always also a text entry.",
  "citation": {
    "source": "GOV.UK Design System — Dates (pattern)",
    "url": "https://design-system.service.gov.uk/patterns/dates/"
  },
  "check": "llm_judgment",
  "pass_when": [
    "A calendar is used only when both conditions hold, and a text entry exists as well (not JS-only)."
  ],
  "fail_when": [
    "Calendar for dates that fail those conditions, or calendar with no text-entry alternative."
  ],
  "severity": "major",
  "container": "forms_and_input",
  "card": "design_a_form",
  "facet": "wrong_control_for_the_choice",
  "leaf": "choose_control_for_choice",
  "waive_reason": "agent_fields pending — do not invent from harvest stencil",
  "do_not_claim": "Date-input-for-memorable as the calendar rule."
}
