{
  "id": "spectrum.toast-placement-geometry",
  "category": "Feedback",
  "segment": "Toast",
  "title": "toast placement geometry",
  "rule": "Default bottom center. Desktop: 16 px from the bottom of the viewport. Mobile: 16 px above the bottom toolbar; never wider than the viewport (8 px left/right margins). If unnoticed or disruptive, may move to bottom end, top end, or top center.",
  "citation": [
    {
      "source": "Spectrum — Toast",
      "url": "https://spectrum.adobe.com/page/toast/"
    }
  ],
  "check": "deterministic",
  "pass_when": [
    "Default is bottom center with those desktop/mobile offsets and margins; alternate corners only if unnoticed or disruptive."
  ],
  "fail_when": [
    "Default placement other than bottom center with no unnoticed/disruptive reason, or toast wider than the viewport / overlapping the cited margins."
  ],
  "severity": "major",
  "container": "feedback_and_status",
  "card": "compose_feedback",
  "facet": "system_stayed_quiet_after_change",
  "leaf": "announce_system_status",
  "overview": "Default toast placement is bottom center with fixed desktop and mobile offsets.",
  "apply_when": "Positioning confirmation and notification toasts in the viewport.",
  "not_when": "Dialogs, modals, or sitewide banners that use their own placement rules.",
  "agent_hint": "Default toasts to bottom center with cited offsets; move only if unnoticed or disruptive.",
  "description": "Spectrum places toasts at bottom center by default: 16 px from the desktop viewport bottom, or 16 px above the mobile bottom toolbar, never wider than the viewport with 8 px left and right margins. Alternate corners (bottom end, top end, top center) are allowed only when the default is unnoticed or disruptive. Wrong defaults without that reason, or toasts that spill past the viewport margins, fail the geometry.",
  "do_not_claim": "Ant Message top-center as a house winner."
}
