{
  "id": "forms.field_labels.visible_label",
  "category": "Forms",
  "segment": "Field labels",
  "title": "visible label",
  "rule": "Place a clear label outside the field so users always know what information belongs there.",
  "citation": {
    "source": "NN/g — Placeholders in Form Fields Are Harmful; Material 3 — Text fields",
    "url": "https://www.nngroup.com/articles/form-design-placeholders/"
  },
  "check": "deterministic",
  "pass_when": [
    "Each input has a clear label outside the field, visible before and during use."
  ],
  "fail_when": [
    "No outside label; the field is named only by inside text or not at all."
  ],
  "severity": "major",
  "container": "forms_and_input",
  "card": "design_a_form",
  "facet": "field_has_no_lasting_name",
  "leaf": "avoid_placeholder_as_label",
  "overview": "A lasting label outside the field names what the input is for.",
  "apply_when": "Labeling signup, settings, or checkout fields.",
  "not_when": "Button/CTA wording — use action-label rules. Inline validation after submit — that is handle_form_errors.",
  "agent_hint": "Require a visible label outside the field. Placeholder is not the name.",
  "description": "A field must keep saying what belongs in it the whole time someone uses it. A label outside the control stays visible while they type; placeholder-only (or a floating label that vanishes when filled) stops naming the field at the moment it matters. Use this for text inputs, selects, and similar data-entry controls — not for button/CTA wording."
}
