{
  "id": "nng.avoid-cascading-dropdowns",
  "category": "Forms",
  "segment": "Choice",
  "title": "avoid cascading dropdowns",
  "rule": "Avoid cascading/interdependent dropdowns (options that appear/disappear from another widget).",
  "citation": {
    "source": "NN/g — Dropdowns: Design Guidelines",
    "url": "https://www.nngroup.com/articles/drop-down-menus/"
  },
  "check": "llm_judgment",
  "pass_when": [
    "Choice sets are not chained so that a second dropdown’s options appear/disappear from the first."
  ],
  "fail_when": [
    "Interdependent dropdowns where the next list is populated only by the previous widget."
  ],
  "severity": "major",
  "container": "forms_and_input",
  "card": "design_a_form",
  "facet": "wrong_control_for_the_choice",
  "leaf": "choose_control_for_choice",
  "waive_reason": "agent_fields pending — do not invent from harvest stencil",
  "do_not_claim": "GOV.UK conditional reveal of a related question (different pattern)."
}
