{
  "id": "spectrum.toast-auto-dismiss-min-5s",
  "category": "Feedback",
  "segment": "Toast",
  "title": "toast auto dismiss min 5s",
  "rule": "Auto-dismiss ≥ 5 seconds so the message can be read. If an actionable toast auto-dismisses, the action must remain available elsewhere. Pause the timer on focus or hover (including keyboard focus on toast buttons).",
  "citation": [
    {
      "source": "Spectrum — Toast",
      "url": "https://spectrum.adobe.com/page/toast/"
    }
  ],
  "check": "deterministic",
  "pass_when": [
    "Auto-dismiss is at least 5 seconds; timer pauses on focus/hover; an actionable toast's action remains available elsewhere after dismiss."
  ],
  "fail_when": [
    "Auto-dismiss under 5 seconds; timer ignores focus/hover; or the only path to the action vanishes with the toast."
  ],
  "severity": "major",
  "container": "feedback_and_status",
  "card": "compose_feedback",
  "facet": "system_stayed_quiet_after_change",
  "leaf": "announce_system_status",
  "overview": "Auto-dismiss lasts at least five seconds and pauses on focus or hover.",
  "apply_when": "Timed toasts that confirm or notify without requiring a blocking response.",
  "not_when": "Dialogs that need attention, or sticky alerts users must dismiss themselves.",
  "agent_hint": "Keep auto-dismiss ≥5s, pause on focus/hover, and preserve actionable paths elsewhere.",
  "description": "Spectrum auto-dismiss toasts stay up at least five seconds so the message can be read, pause the timer on focus or hover (including keyboard focus on toast buttons), and keep any actionable path available elsewhere if the toast dismisses. Shorter timers, timers that ignore focus, or actions that vanish with the toast fail the bar. Use this for low-priority timed feedback; escalate harder decisions to dialogs.",
  "do_not_claim": "Ant Message default 3s as a house winner; snackbar-only undo (`nng.support-undo-discoverable`)."
}
